{
  "page_json": "0.2",
  "source": {
    "id": "o_szd.1736",
    "title": "Ansichtspostkarte an Eugenie Hirschfeld vom 2. Februar 1909, SZ-SEF/B5.16",
    "language": "de",
    "collection": "korrespondenzen",
    "shelfmark": "",
    "images": [
      "https://gams.uni-graz.at/o:szd.1736/IMG.1",
      "https://gams.uni-graz.at/o:szd.1736/IMG.2",
      "https://gams.uni-graz.at/o:szd.1736/IMG.3"
    ],
    "document_type": "letter",
    "descriptive_metadata": {
      "rights": "CC-BY"
    },
    "additional": {
      "group": "korrespondenz",
      "context": "## Dieses Dokument\n\n- Titel: Ansichtspostkarte an Eugenie Hirschfeld vom 2. Februar 1909, SZ-SEF/B5.16\n- Signatur: SZ-SEF/B5.16\n- Sprache: Deutsch\n- Objekttyp: Brief\n- Umfang: 3 Scans"
    }
  },
  "provenance": {
    "model": "gemini-3.1-flash-lite-preview",
    "created_at": "2026-04-03T16:07:58.831578+00:00",
    "provider": "google",
    "pipeline": "szd-htr",
    "prompt_layers": [
      "system",
      "group_korrespondenz",
      "object_context"
    ],
    "parameters": {
      "temperature": 0.1
    }
  },
  "pages": [
    {
      "page": 1,
      "type": "content",
      "text": "Anfang April wieder in\nWien. Pele\n\n[...]\nStefan Zweig",
      "notes": "Vorderseite der Postkarte mit Bildmotiv. Handschriftliche Notiz am linken Rand und rechts oben. 'Pele' ist ein Kosename für Stefan Zweig. Die Unterschrift ist leicht schräg geschrieben."
    },
    {
      "page": 2,
      "type": "content",
      "text": "Austria (Europe)\n\nUniversal postal Union- Union postale universelle\nBRITISH INDIA\nPOST CARD\nINDE BRITANNIQUE\nCARTE POSTALE\nTHE ADDRESS ONLY TO BE WRITTEN ON THIS SIDE\n\nfräulein Eugenie Hirschfeld\n\nVienna (Austria)\nII. Un[?]sdorferstrasse 5",
      "notes": "Rückseite der Postkarte mit gedruckten Adressfeldern und Briefmarke. Handschriftliche Anschrift. Das Wort 'Un[?]sdorferstrasse' ist aufgrund des Poststempels leicht überlagert, vermutlich 'Untere Donaustrasse' oder 'Unsdorferstrasse' (hier: Un[?]sdorferstrasse)."
    },
    {
      "page": 3,
      "type": "blank",
      "text": "",
      "notes": "Übersichtsbild mit Farbskalen und Grauskalen für Archivierungszwecke. Keine neuen Textinhalte."
    }
  ],
  "confidence": "high",
  "confidence_notes": "Der Text ist gut lesbar. Die Unsicherheit bei der Straßenbezeichnung auf Seite 2 resultiert aus der Überlagerung durch den Poststempel.",
  "quality": {
    "needs_review": false,
    "needs_review_reasons": [],
    "total_chars": 292,
    "total_words": 42,
    "language_detected": "en",
    "language_match": true
  }
}