{
  "page_json": "0.2",
  "source": {
    "id": "o_szd.994",
    "title": "Brief an Sigmund Freud vom 8. September 1926, SZ-LAS/B7.7",
    "language": "de",
    "collection": "korrespondenzen",
    "shelfmark": "",
    "images": [
      "https://gams.uni-graz.at/o:szd.994/IMG.1",
      "https://gams.uni-graz.at/o:szd.994/IMG.2",
      "https://gams.uni-graz.at/o:szd.994/IMG.3"
    ],
    "document_type": "letter",
    "descriptive_metadata": {
      "rights": "CC-BY"
    },
    "additional": {
      "group": "korrespondenz",
      "context": "## Dieses Dokument\n\n- Titel: Brief an Sigmund Freud vom 8. September 1926, SZ-LAS/B7.7\n- Sprache: Deutsch\n- Objekttyp: Brief\n- Umfang: 3 Scans"
    }
  },
  "provenance": {
    "model": "gemini-3.1-flash-lite-preview",
    "created_at": "2026-04-03T16:08:48.996381+00:00",
    "provider": "google",
    "pipeline": "szd-htr",
    "prompt_layers": [
      "system",
      "group_korrespondenz",
      "object_context"
    ],
    "parameters": {
      "temperature": 0.1
    }
  },
  "pages": [
    {
      "page": 1,
      "type": "content",
      "text": "KAPUZINERBERG 5\nSALZBURG 8. Sept 1926\n\nVerehrtester Herr Profesor, neben Ihrem geistigen Werthaben\nSie noch wunderbar eine grosse Kunst: durch Güte zu beschämen!\nNicht die Worte nur, die Sie mir sagten, sondern die Tatsache schon,\ndass Sie, überhäuft, bedrängt von Menschen und Problemen in der\nZeit der Erholung sich die Musse nahmen, so tiefgründig in ein Werk\nzu blicken, das doch Ihnen unendlich vieles dankt, macht mich wirklich\nverwirrt – ich konnte gestern gar nicht die Feder führen.\nLassen Sie mich einmal klar sagen, was ich, was viele Ihnen danken\n– den Mut in der Psychologie. Sie haben, wie zahllosen einzelnen Men-\nschen der Literatur einer ganzen Epoche die Hemmungen weggenommen.\nDank Ihnen sehen wir vieles, – Dank Ihnen sagen wir Alles, was sonst\nnicht gesehen und nicht gesagt worden wäre. Das ist heute alles noch\nnicht klar, weil unsere Richtung noch nicht historisch, nicht in ihren\nursächlichlichen Formen gesehen wird – ein Jahrzehnt noch oder zwei,\ndann wird man erkennen, wo der Zusammenhang war, der plötzlich\nProust in Frankreich, Lawrence und Joyce in England, der einigen\nDeutschen eine andere Psychologische Kühnheit gab. So wird Ihr Name\nsein. Und wir werden nie diesen grossen Eröffner verleugnen.\nNur ist Psychologie (Sie verstehen dies wie kein zweiter) heute eigentlich\ndie Passion meines Lebens. Und ich möchte dann einmal, wenn ich weit\ngenug bin, sie am schwersten Object üben, an mir selbst. Auch die Selbst-\nbiografie der nachfreudischen Zeit darf klarer und kühner sein, als all die\nder früheren. Ich studiere eben Tolstoi in dieser Hinsicht – jeden Tag\nredet er sich zu, kühn und wahr zu sein. Aber vor den wirklich klaren",
      "notes": "Handschriftlicher Brief auf Briefpapier mit Briefkopf. Violette Tinte. Sehr gut lesbar."
    },
    {
      "page": 2,
      "type": "content",
      "text": "Wahrheiten weicht er aus. Es ist ihm bislang noch nie scharf auf den Leib ge-\nrückt worden und ich habe sehr Lust dazu. Von den neueren war Kühn (ohne\ngenug Erkenntnis) Hans Jäger in der „Christiania-boheme“ und Kraure [?] Seel[e].\nAuch das nur noch unzugängliche Buch von Frank Harris soll es sein. Aber\nich glaube, unsere Zeit, die produktiv schwach ist, wird Erkenntnisse nur do-\ncumente hinterlassen: Den Mut dazu dankt sie Ihnen.\nIch habe keinen innigeren Wunsch als dass Ihre Gesundheit\nstabil, Ihr Werk in wachen Blicke: noch immer sind Sie der Entscheidende\nim unsichtbaren Kampf um die Seele. Noch immer der Einzige, der die\nMechanik des Geistigen uns schöpferisch erklärt. Wir brauchen Sie mehr\ndenn je als einen Tätigen.\nIn Liebe Dankbarkeit und Verehrung\nIhr getreu ergebener\nStefan Zweig",
      "notes": "Handschriftlicher Brief, Fortsetzung von Seite 1. Violette Tinte. 'Kraure' könnte auch 'Kruse' oder ähnlich sein, schwer lesbar."
    },
    {
      "page": 3,
      "type": "color_chart",
      "text": "Wahrheiten weicht er aus. Es ist ihm bislang noch nie scharf auf den Leib ge-\nrückt worden und ich habe sehr Lust dazu. Von den neueren war Kühn (ohne\ngenug Erkenntnis) Hans Jäger in der „Christiania-boheme“ und Kraure [?] Seel[e].\nAuch das nur noch unzugängliche Buch von Frank Harris soll es sein. Aber\nich glaube, unsere Zeit, die produktiv schwach ist, wird Erkenntnisse nur do-\ncumente hinterlassen: Den Mut dazu dankt sie Ihnen.\nIch habe keinen innigeren Wunsch als dass Ihre Gesundheit\nstabil, Ihr Werk in wachen Blicke: noch immer sind Sie der Entscheidende\nim unsichtbaren Kampf um die Seele. Noch immer der Einzige, der die\nMechanik des Geistigen uns schöpferisch erklärt. Wir brauchen Sie mehr\ndenn je als einen Tätigen.\nIn Liebe Dankbarkeit und Verehrung\nIhr getreu ergebener\nStefan Zweig",
      "notes": "Identisch mit Seite 2, jedoch mit Archiv-Farbskala am unteren Rand."
    }
  ],
  "confidence": "high",
  "confidence_notes": "Der Text ist sehr gut lesbar, die Handschrift von Stefan Zweig ist bekannt und klar. Einzig ein Eigenname in Zeile 3 von Seite 2/3 ist leicht unsicher.",
  "quality": {
    "needs_review": false,
    "needs_review_reasons": [],
    "total_chars": 3265,
    "total_words": 532,
    "language_detected": "de",
    "language_match": true
  }
}