{
  "page_json": "0.2",
  "source": {
    "id": "o_szd.2241",
    "title": "Ein Verbummelter",
    "language": "de",
    "collection": "aufsatzablage",
    "shelfmark": "SZ-AAP/W-AA201.0",
    "images": [
      "https://gams.uni-graz.at/o:szd.2241/IMG.1",
      "https://gams.uni-graz.at/o:szd.2241/IMG.2",
      "https://gams.uni-graz.at/o:szd.2241/IMG.3",
      "https://gams.uni-graz.at/o:szd.2241/IMG.4",
      "https://gams.uni-graz.at/o:szd.2241/IMG.5",
      "https://gams.uni-graz.at/o:szd.2241/IMG.6",
      "https://gams.uni-graz.at/o:szd.2241/IMG.7"
    ],
    "document_type": "manuscript",
    "repository": "Literaturarchiv Salzburg",
    "descriptive_metadata": {
      "creator": [
        {
          "name": "Erwin Rieger",
          "role": "contributor",
          "gnd": "http://d-nb.info/gnd/116538597"
        }
      ],
      "subject": [
        "Registerblätter"
      ],
      "extent": "1 Blatt",
      "rights": "CC-BY",
      "holding": {
        "repository": "Literaturarchiv Salzburg",
        "repository_gnd": "http://d-nb.info/gnd/1047605287",
        "country": "Österreich",
        "settlement": "Salzburg"
      },
      "provenance": [
        "Archiv Atrium Press",
        "Erwerb: Ankauf Christie's London 2014"
      ],
      "physical_description": {
        "writing_instrument": "Violette Tinte, schwarze Tinte",
        "hands": [
          "Erwin Rieger",
          "Unbekannt"
        ]
      }
    },
    "additional": {
      "group": "handschrift",
      "context": "## Dieses Dokument\n\n- Titel: Ein Verbummelter\n- Signatur: SZ-AAP/W-AA201.0\n- Sprache: Deutsch\n- Objekttyp: Manuskript\n- Umfang: 1 Blatt\n- Schreibinstrument: Violette\n                                       Tinte, schwarze Tinte\n- Hand: Erwin Rieger, Unbekannt"
    }
  },
  "provenance": {
    "model": "gemini-3.1-flash-lite-preview",
    "created_at": "2026-04-03T16:05:57.949074+00:00",
    "provider": "google",
    "pipeline": "szd-htr",
    "prompt_layers": [
      "system",
      "group_handschrift",
      "object_context"
    ],
    "parameters": {
      "temperature": 0.1
    }
  },
  "pages": [
    {
      "page": 1,
      "type": "content",
      "text": "Ein Verbummelter\n\nEin Verbummelter",
      "notes": "Das Dokument besteht aus einem Blatt, das einmal gefaltet ist. Der Text erscheint zweimal: einmal oben auf der Vorderseite (unterstrichen) und einmal weiter unten auf der gleichen Seite."
    },
    {
      "page": 2,
      "type": "blank",
      "text": "",
      "notes": "Rückseite des oberen Teils des gefalteten Blattes. Leer."
    },
    {
      "page": 3,
      "type": "content",
      "text": "Ein Verbummelter",
      "notes": "Innere Seite des gefalteten Blattes."
    },
    {
      "page": 4,
      "type": "blank",
      "text": "",
      "notes": "Rückseite des unteren Teils des gefalteten Blattes. Leer."
    },
    {
      "page": 5,
      "type": "content",
      "text": "Ein Verbummelter",
      "notes": "Ausschnitt/Detailansicht der oberen Zeile."
    },
    {
      "page": 6,
      "type": "blank",
      "text": "",
      "notes": "Leere Seite."
    },
    {
      "page": 7,
      "type": "color_chart",
      "text": "Ein Verbummelter\n\nEin Verbummelter",
      "notes": "Gesamtansicht des Blattes mit Farbskala und Graustufenkarte."
    }
  ],
  "confidence": "high",
  "confidence_notes": "Der Text ist sehr kurz und deutlich lesbar.",
  "quality": {
    "needs_review": false,
    "needs_review_reasons": [],
    "total_chars": 100,
    "total_words": 12,
    "language_detected": "",
    "language_match": true
  }
}