{
  "page_json": "0.2",
  "source": {
    "id": "o_szd.426",
    "title": "André Mabille de Poncheville an Stefan Zweig, 1913-05-09, SZ-SAM/AK.143",
    "language": "de",
    "collection": "korrespondenzen",
    "shelfmark": "",
    "images": [
      "https://gams.uni-graz.at/o:szd.426/IMG.1",
      "https://gams.uni-graz.at/o:szd.426/IMG.2",
      "https://gams.uni-graz.at/o:szd.426/IMG.3"
    ],
    "document_type": "letter",
    "descriptive_metadata": {
      "rights": "CC-BY"
    },
    "additional": {
      "group": "korrespondenz",
      "context": "## Dieses Dokument\n\n- Titel: André Mabille de Poncheville an Stefan Zweig, 1913-05-09, SZ-SAM/AK.143\n- Signatur: Literaturarchiv Salzburg, SZ-SAM/AK.143\n- Sprache: Deutsch\n- Objekttyp: Brief\n- Umfang: 3 Scans"
    }
  },
  "provenance": {
    "model": "gemini-3.1-flash-lite-preview",
    "created_at": "2026-04-03T16:08:08.529580+00:00",
    "provider": "google",
    "pipeline": "szd-htr",
    "prompt_layers": [
      "system",
      "group_korrespondenz",
      "object_context"
    ],
    "parameters": {
      "temperature": 0.1
    }
  },
  "pages": [
    {
      "page": 1,
      "type": "content",
      "text": "837. Montmartre – Le Lapin Agile en hiver – Coin Saint-Vincent\nParis 9. Mai 1913",
      "notes": "Vorderseite einer Ansichtskarte mit Motiv 'Le Lapin Agile'. Der Text 'Paris 9. Mai 1913' ist handschriftlich unter dem gedruckten Titel hinzugefügt."
    },
    {
      "page": 2,
      "type": "content",
      "text": "Paris, le 9 mai 1913\nJ'ai reçu\nMerci, ce\nbeau livre, et je re-\ngrette bien de ne pas\nsavoir assez l'allemand\npour le lire. Je me console\nen le regardant, comme\nfaisaient les œuvres\nd'Homère les poètes de\nla Renaissance qui ne sa-\nvaient pas le grec. Voir\nle livre du poète leur était\ndéjà un plaisir.\nMerci encore, à l'été\n1914, je l'espère, au Caillon!\nCroyez-moi, très dévoué\nPoncheville\n\nM. Stephan Zweig\nVIII. Kochgasse 8\nVienne\nAutriche",
      "notes": "Rückseite der Ansichtskarte. Handschriftlicher Text in französischer Sprache. Briefmarke oben rechts, Poststempel teilweise lesbar."
    },
    {
      "page": 3,
      "type": "color_chart",
      "text": "",
      "notes": "Grauskala und Farbkarte für Archivierung."
    }
  ],
  "confidence": "high",
  "confidence_notes": "Der Text ist gut lesbar, die Handschrift ist klar. Die Transkription folgt dem Originaltext auf der Postkarte.",
  "quality": {
    "needs_review": true,
    "needs_review_reasons": [
      "language_mismatch"
    ],
    "total_chars": 521,
    "total_words": 94,
    "language_detected": "fr",
    "language_match": false
  }
}