{
  "page_json": "0.2",
  "source": {
    "id": "o_szd.1199",
    "title": "Brief an Anna Meingast vom 24. März 1934, SZ-SAM/B7.29",
    "language": "de",
    "collection": "korrespondenzen",
    "shelfmark": "",
    "images": [
      "https://gams.uni-graz.at/o:szd.1199/IMG.1",
      "https://gams.uni-graz.at/o:szd.1199/IMG.2"
    ],
    "document_type": "letter",
    "descriptive_metadata": {
      "rights": "CC-BY"
    },
    "additional": {
      "group": "korrespondenz",
      "context": "## Dieses Dokument\n\n- Titel: Brief an Anna Meingast vom 24. März 1934, SZ-SAM/B7.29\n- Signatur: SZ-SAM/B7.29\n- Sprache: Deutsch\n- Objekttyp: Brief\n- Umfang: 2 Scans"
    }
  },
  "provenance": {
    "model": "gemini-3.1-flash-lite-preview",
    "created_at": "2026-04-03T16:07:19.333746+00:00",
    "provider": "google",
    "pipeline": "szd-htr",
    "prompt_layers": [
      "system",
      "group_korrespondenz",
      "object_context"
    ],
    "parameters": {
      "temperature": 0.1
    }
  },
  "pages": [
    {
      "page": 1,
      "type": "content",
      "text": "11 Portland Place                                London, den 24. März 1934.\n\nLiebe Frau Meingast!\n\nIch danke Ihnen sehr für Ihre regelmässigen Nachrichten. Sorgen Sie sich nicht zu sehr, dass Sie jetzt nicht so viel zu tun haben, ich hoffe, wenn man mir leidlich Ruhe lässt, doch bald so weit zu sein, dass wenigstens das eine oder das andere Kapitel von Maria Stuart Ihnen zum Kopieren zugeschickt wird. Die Korrespondenz wird ja allmählich immer mehr einschlafen, worüber ich nicht böse bin.\n\nWenn Sie jetzt Zeit haben, könnten Sie einmal die ganzen alten Korrespondenzen mit Zeitungen, Verlegern, Vorträgen usw. durchsehen und vielleicht einen grossen Teil davon vernichten. Die ganzen Vorlesungskorrespondenzen an sich, insbesondere mit Deutschland, sind ja völlig illusorisch, da ich doch auf keinen dieser Anträge mehr zurückkomme, ebenso die ganzen Hin- und Herschreibereien mit deutschen Zeitungen. Je weniger man an solchen unnützen Briefpacken zu Hause hat, umso besser. Vielleicht vernichten Sie also einen Teil; wo Sie vollkommen sicher sind, dass es belanglos ist, selbst und legen den Teil, wo Sie ungewiss sind, zusammen, dass dann meine Frau und ich, wenn wir kommen, entscheiden können. Mein Hauptinteresse ist, diese grässliche Papierbelastung etwas einzudämmen.\n\nBitte grüssen Sie mir vielmals Johann und Herrn und",
      "notes": "Der Brief bricht am Ende der Seite ab."
    },
    {
      "page": 2,
      "type": "content",
      "text": "Frau Schierl, sie mögen entschuldigen, dass ich nicht schreibe,\naber ich habe viel zu tun, denn ich will und muss vorwärtskommen.\n\nMit den besten Grüssen Ihr\n\nStefan Zweig\n\n{Herrn Haus}\nAn den Schneider zahlen Sie bitte die fünf Schillinge ein.",
      "notes": "Die Unterschrift 'Stefan Zweig' ist in violetter Tinte handschriftlich ausgeführt. Die Zeile '{Herrn Haus}' ist handschriftlich über der letzten Zeile eingefügt."
    }
  ],
  "confidence": "high",
  "confidence_notes": "Der Text ist maschinenschriftlich sehr gut lesbar. Die handschriftlichen Ergänzungen und die Unterschrift sind eindeutig identifizierbar.",
  "quality": {
    "needs_review": false,
    "needs_review_reasons": [],
    "total_chars": 1577,
    "total_words": 237,
    "language_detected": "de",
    "language_match": true
  }
}